{
  "$schema": "../metadata/performance-report.schema.json",
  "schemaVersion": 1,
  "version": "2.2.0",
  "generatedAt": "2026-09-08T08:37:00.513Z",
  "status": "passed",
  "compression": {
    "gzipLevel": 9,
    "brotliQuality": 11
  },
  "artifacts": {
    "gardener.min.css": {
      "limits": {
        "raw": 1969000,
        "gzip": 275000,
        "brotli": 160000
      },
      "actual": {
        "raw": 1968231,
        "gzip": 274562,
        "brotli": 158032
      },
      "pass": true
    },
    "gardener.core.min.css": {
      "limits": {
        "raw": 65000,
        "gzip": 9000,
        "brotli": 6000
      },
      "actual": {
        "raw": 63616,
        "gzip": 8334,
        "brotli": 5762
      },
      "pass": true
    },
    "gardener.themes.min.css": {
      "limits": {
        "raw": 60000,
        "gzip": 7500,
        "brotli": 5000
      },
      "actual": {
        "raw": 59577,
        "gzip": 6844,
        "brotli": 4539
      },
      "pass": true
    },
    "gardener.utilities.min.css": {
      "limits": {
        "raw": 550000,
        "gzip": 80000,
        "brotli": 18000
      },
      "actual": {
        "raw": 533948,
        "gzip": 76718,
        "brotli": 14675
      },
      "pass": true
    },
    "gardener.components.min.css": {
      "limits": {
        "raw": 1332000,
        "gzip": 185200,
        "brotli": 135000
      },
      "actual": {
        "raw": 1331130,
        "gzip": 185022,
        "brotli": 134414
      },
      "pass": true
    },
    "gardener.ai.min.css": {
      "limits": {
        "raw": 43000,
        "gzip": 7100,
        "brotli": 6300
      },
      "actual": {
        "raw": 40130,
        "gzip": 6716,
        "brotli": 5950
      },
      "pass": true
    },
    "gardener.runtime.min.js": {
      "limits": {
        "raw": 276000,
        "gzip": 77500,
        "brotli": 66000
      },
      "actual": {
        "raw": 275562,
        "gzip": 77417,
        "brotli": 65031
      },
      "pass": true
    },
    "gardener.tauri.min.js": {
      "limits": {
        "raw": 1700,
        "gzip": 900,
        "brotli": 800
      },
      "actual": {
        "raw": 1421,
        "gzip": 737,
        "brotli": 610
      },
      "pass": true
    },
    "gardener.electron.min.js": {
      "limits": {
        "raw": 1400,
        "gzip": 800,
        "brotli": 700
      },
      "actual": {
        "raw": 1059,
        "gzip": 580,
        "brotli": 476
      },
      "pass": true
    },
    "platforms/gardener.web.min.css": {
      "limits": {
        "raw": 1873000,
        "gzip": 262000,
        "brotli": 149000
      },
      "actual": {
        "raw": 1872586,
        "gzip": 261333,
        "brotli": 148485
      },
      "pass": true
    },
    "platforms/gardener.mobile.min.css": {
      "limits": {
        "raw": 1910000,
        "gzip": 267000,
        "brotli": 154000
      },
      "actual": {
        "raw": 1909011,
        "gzip": 266695,
        "brotli": 152303
      },
      "pass": true
    },
    "platforms/gardener.desktop.min.css": {
      "limits": {
        "raw": 1932000,
        "gzip": 270000,
        "brotli": 154000
      },
      "actual": {
        "raw": 1931761,
        "gzip": 269546,
        "brotli": 153431
      },
      "pass": true
    },
    "platforms/gardener.tauri.min.css": {
      "limits": {
        "raw": 256,
        "gzip": 256,
        "brotli": 256
      },
      "actual": {
        "raw": 69,
        "gzip": 84,
        "brotli": 73
      },
      "pass": true
    },
    "platforms/gardener.electron.min.css": {
      "limits": {
        "raw": 256,
        "gzip": 256,
        "brotli": 256
      },
      "actual": {
        "raw": 69,
        "gzip": 84,
        "brotli": 73
      },
      "pass": true
    },
    "components/layouts.min.css": {
      "limits": {
        "raw": 38000,
        "gzip": 7000,
        "brotli": 6000
      },
      "actual": {
        "raw": 36871,
        "gzip": 6026,
        "brotli": 5344
      },
      "pass": true
    },
    "components/regions.min.css": {
      "limits": {
        "raw": 11000,
        "gzip": 2300,
        "brotli": 2000
      },
      "actual": {
        "raw": 9445,
        "gzip": 1886,
        "brotli": 1670
      },
      "pass": true
    },
    "components/primitives.min.css": {
      "limits": {
        "raw": 11000,
        "gzip": 2700,
        "brotli": 2400
      },
      "actual": {
        "raw": 9290,
        "gzip": 2247,
        "brotli": 2008
      },
      "pass": true
    },
    "components/grid.min.css": {
      "limits": {
        "raw": 80000,
        "gzip": 8000,
        "brotli": 3000
      },
      "actual": {
        "raw": 72407,
        "gzip": 6885,
        "brotli": 2402
      },
      "pass": true
    },
    "components/basic.min.css": {
      "limits": {
        "raw": 76000,
        "gzip": 14000,
        "brotli": 12000
      },
      "actual": {
        "raw": 75630,
        "gzip": 13050,
        "brotli": 11496
      },
      "pass": true
    },
    "components/forms.min.css": {
      "limits": {
        "raw": 106000,
        "gzip": 14000,
        "brotli": 12000
      },
      "actual": {
        "raw": 105650,
        "gzip": 13894,
        "brotli": 11891
      },
      "pass": true
    },
    "components/form-compositions.min.css": {
      "limits": {
        "raw": 177000,
        "gzip": 23000,
        "brotli": 19000
      },
      "actual": {
        "raw": 172495,
        "gzip": 22005,
        "brotli": 17908
      },
      "pass": true
    },
    "components/navigation.min.css": {
      "limits": {
        "raw": 84000,
        "gzip": 12500,
        "brotli": 11000
      },
      "actual": {
        "raw": 82793,
        "gzip": 12388,
        "brotli": 10897
      },
      "pass": true
    },
    "components/navigation-compositions.min.css": {
      "limits": {
        "raw": 50000,
        "gzip": 7000,
        "brotli": 7000
      },
      "actual": {
        "raw": 47989,
        "gzip": 6608,
        "brotli": 5869
      },
      "pass": true
    },
    "components/feedback.min.css": {
      "limits": {
        "raw": 35000,
        "gzip": 7000,
        "brotli": 6000
      },
      "actual": {
        "raw": 34449,
        "gzip": 6308,
        "brotli": 5604
      },
      "pass": true
    },
    "components/data.min.css": {
      "limits": {
        "raw": 97000,
        "gzip": 17000,
        "brotli": 15000
      },
      "actual": {
        "raw": 96378,
        "gzip": 16739,
        "brotli": 14203
      },
      "pass": true
    },
    "components/data-compositions.min.css": {
      "limits": {
        "raw": 24500,
        "gzip": 4500,
        "brotli": 4000
      },
      "actual": {
        "raw": 24097,
        "gzip": 4116,
        "brotli": 3659
      },
      "pass": true
    },
    "components/selection-compositions.min.css": {
      "limits": {
        "raw": 55000,
        "gzip": 8000,
        "brotli": 7000
      },
      "actual": {
        "raw": 54284,
        "gzip": 7290,
        "brotli": 6441
      },
      "pass": true
    },
    "components/content-compositions.min.css": {
      "limits": {
        "raw": 66000,
        "gzip": 10000,
        "brotli": 8800
      },
      "actual": {
        "raw": 65542,
        "gzip": 9798,
        "brotli": 8577
      },
      "pass": true
    },
    "components/auth-compositions.min.css": {
      "limits": {
        "raw": 33000,
        "gzip": 6300,
        "brotli": 5600
      },
      "actual": {
        "raw": 30582,
        "gzip": 5762,
        "brotli": 5073
      },
      "pass": true
    },
    "components/commerce-compositions.min.css": {
      "limits": {
        "raw": 40000,
        "gzip": 6800,
        "brotli": 6000
      },
      "actual": {
        "raw": 35908,
        "gzip": 6017,
        "brotli": 5349
      },
      "pass": true
    },
    "components/mobile-compositions.min.css": {
      "limits": {
        "raw": 45000,
        "gzip": 8500,
        "brotli": 7500
      },
      "actual": {
        "raw": 36568,
        "gzip": 6255,
        "brotli": 5621
      },
      "pass": true
    },
    "components/extended.min.css": {
      "limits": {
        "raw": 62000,
        "gzip": 10600,
        "brotli": 9500
      },
      "actual": {
        "raw": 59919,
        "gzip": 10239,
        "brotli": 9150
      },
      "pass": true
    },
    "components/page.min.css": {
      "limits": {
        "raw": 60000,
        "gzip": 10000,
        "brotli": 9000
      },
      "actual": {
        "raw": 58089,
        "gzip": 9133,
        "brotli": 7924
      },
      "pass": true
    },
    "components/help.min.css": {
      "limits": {
        "raw": 32000,
        "gzip": 5600,
        "brotli": 4900
      },
      "actual": {
        "raw": 29103,
        "gzip": 5111,
        "brotli": 4527
      },
      "pass": true
    },
    "components/recipes.min.css": {
      "limits": {
        "raw": 53000,
        "gzip": 9000,
        "brotli": 8000
      },
      "actual": {
        "raw": 51670,
        "gzip": 8333,
        "brotli": 7401
      },
      "pass": true
    },
    "components/desktop.min.css": {
      "limits": {
        "raw": 18000,
        "gzip": 4000,
        "brotli": 4000
      },
      "actual": {
        "raw": 17334,
        "gzip": 3518,
        "brotli": 3111
      },
      "pass": true
    },
    "components/desktop-compositions.min.css": {
      "limits": {
        "raw": 47000,
        "gzip": 7600,
        "brotli": 6800
      },
      "actual": {
        "raw": 42127,
        "gzip": 6580,
        "brotli": 5808
      },
      "pass": true
    },
    "components/solution-compositions.min.css": {
      "limits": {
        "raw": 52000,
        "gzip": 7200,
        "brotli": 5800
      },
      "actual": {
        "raw": 51240,
        "gzip": 6980,
        "brotli": 5685
      },
      "pass": true
    },
    "components/catalog.min.css": {
      "limits": {